{
  "schema_version": "1.0.0",
  "sample_id": "t04-overclaim-confirmed",
  "media_sha256": "6a07068c9849766bc1d730c26994ee418493a66615183f78ce82a4745f13f632",
  "media_duration_ms": 8000,
  "target_query": "红色正方形",
  "annotation_version": "1.0.0",
  "annotated_at": "2026-09-22T00:00:00Z",
  "annotator_id": "task17-fixture-annotator",
  "boundary_tolerance_ms": 250,
  "segments": [
    {
      "start_ms": 0,
      "end_ms": 3000,
      "state": "confirmed"
    },
    {
      "start_ms": 3000,
      "end_ms": 5000,
      "state": "uncertain"
    },
    {
      "start_ms": 5000,
      "end_ms": 8000,
      "state": "confirmed"
    }
  ],
  "label_frozen": {
    "frozen": true,
    "frozen_at": "2026-09-22T00:00:00Z",
    "freeze_note": "任务 17 规则 fixture（构造真值，非真实素材标注）"
  },
  "revision_history": [],
  "notes": "确定性规则 fixture 的 Ground Truth"
}
