{
  "schema_version": "1.0.0",
  "sample_id": "reappear",
  "media_sha256": "a298c6e36b61f4299cd09ee46bbf0b2999c6049bb71cb8a73856a7b1e9f7d0ca",
  "media_duration_ms": 8000,
  "target_query": "红色正方形",
  "annotation_version": "1.0.0",
  "annotated_at": "2026-09-22T08:00:27.356200+00:00",
  "annotator_id": "task16-fixture-freeze",
  "boundary_tolerance_ms": 250,
  "segments": [
    {
      "start_ms": 0,
      "end_ms": 2000,
      "state": "confirmed"
    },
    {
      "start_ms": 2000,
      "end_ms": 4000,
      "state": "not_found"
    },
    {
      "start_ms": 4000,
      "end_ms": 6000,
      "state": "confirmed"
    },
    {
      "start_ms": 6000,
      "end_ms": 8000,
      "state": "not_found"
    }
  ],
  "label_frozen": {
    "frozen": true,
    "frozen_at": "2026-09-22T08:00:27.356200+00:00",
    "derived_from": "由 artifacts/task-16/fixtures/ground-truth.json（冻结于 2026-09-22T08:00:27Z）按固定映射派生：present->confirmed，absent->not_found，present_low_contrast->uncertain（低对比度区间无法可靠确认）；boundary_tolerance_ms=250（覆盖 24fps 帧量化与百毫秒标注取整，对应任务 16 目标边界精度 500ms 的一半）；未修改任何源标签",
    "freeze_note": "派生自任务 16 冻结 fixture ground truth；technical fixture，不得外推为真实素材结论"
  },
  "revision_history": [],
  "notes": "出现、消失、再次出现（两次进入 + 两次离开）"
}
