{
  "schema_version": "1.0.0",
  "sample_id": "short-event-phase-b",
  "media_sha256": "d2bd059a75c0aa2f6bec0373c5d50fb591d2c20d56c09bbc752eb985c16aee5d",
  "media_duration_ms": 8000,
  "target_query": "红色正方形",
  "annotation_version": "1.0.0",
  "annotated_at": "2026-09-22T11:27:13.916411+00:00",
  "annotator_id": "task18-fixture-freeze",
  "boundary_tolerance_ms": 250,
  "segments": [
    {
      "start_ms": 0,
      "end_ms": 6200,
      "state": "not_found"
    },
    {
      "start_ms": 6200,
      "end_ms": 6800,
      "state": "confirmed"
    },
    {
      "start_ms": 6800,
      "end_ms": 8000,
      "state": "not_found"
    }
  ],
  "label_frozen": {
    "frozen": true,
    "frozen_at": "2026-09-22T11:27:13.916411+00:00",
    "derived_from": "由 artifacts/task-18/fixtures/ground-truth.json（冻结 manifest + ground truth）按固定映射派生：present->confirmed，absent->not_found，present_low_contrast->uncertain；boundary_tolerance_ms=250（覆盖 24fps 帧量化与百毫秒标注取整，对应任务 16 目标边界精度 500ms 的一半）；未修改任何源标签",
    "freeze_note": "任务 18 三臂评测 fixture ground truth；technical fixture，不得外推为真实素材结论"
  },
  "revision_history": [],
  "notes": "相位移动的短 confirmed 事件；相位移动的短 confirmed 事件（6200–6800 ms；与 short-event-between-grid 语义相同、时间相位不同，防止只对单一时间位置调参）"
}
