{
  "schema_version": "1.0.0",
  "sample_id": "twin-short-events",
  "media_sha256": "27a44ff7ac55f5d304eeaf0dc4ee6f9c51b541b55d1ae13303e807047ea68b7b",
  "media_duration_ms": 8000,
  "target_query": "红色正方形",
  "annotation_version": "1.0.0",
  "annotated_at": "2026-09-22T11:27:13.916411+00:00",
  "annotator_id": "task18-fixture-freeze",
  "boundary_tolerance_ms": 250,
  "segments": [
    {
      "start_ms": 0,
      "end_ms": 1600,
      "state": "not_found"
    },
    {
      "start_ms": 1600,
      "end_ms": 2200,
      "state": "confirmed"
    },
    {
      "start_ms": 2200,
      "end_ms": 3000,
      "state": "not_found"
    },
    {
      "start_ms": 3000,
      "end_ms": 3600,
      "state": "confirmed"
    },
    {
      "start_ms": 3600,
      "end_ms": 8000,
      "state": "not_found"
    }
  ],
  "label_frozen": {
    "frozen": true,
    "frozen_at": "2026-09-22T11:27:13.916411+00:00",
    "derived_from": "由 artifacts/task-18/fixtures/ground-truth.json（冻结 manifest + ground truth）按固定映射派生：present->confirmed，absent->not_found，present_low_contrast->uncertain；boundary_tolerance_ms=250（覆盖 24fps 帧量化与百毫秒标注取整，对应任务 16 目标边界精度 500ms 的一半）；未修改任何源标签",
    "freeze_note": "任务 18 三臂评测 fixture ground truth；technical fixture，不得外推为真实素材结论"
  },
  "revision_history": [],
  "notes": "两个间隔较短的事件；两个间隔较短的事件（1600–2200 ms 与 3000–3600 ms，各 600ms，均落在 coarse 网格间隔内）"
}
